{
  "agents": [
    {
      "agent_id": "PERCEPTION_AGENT",
      "allowed_tool_ids": [
        "PDF_PAGE_LOOKUP",
        "KEYFRAME_LOOKUP",
        "VIDEO_INTERVAL_LOOKUP",
        "AUDIO_INTERVAL_LOOKUP",
        "EVIDENCE_SEARCH"
      ],
      "calls": [
        {
          "call_id": "A01-C01",
          "evidence_bound": true,
          "execution_basis": "LOCAL_DETERMINISTIC",
          "human_gate": false,
          "input_artifact_ids": [
            "INGEST_MANIFEST"
          ],
          "output_artifact_ids": [
            "PDF_STRUCTURE"
          ],
          "purpose": "保留手册原页码并建立可检索结构报告。",
          "sequence": 1,
          "status": "COMPLETED",
          "tool_id": "PDF_PAGE_LOOKUP"
        },
        {
          "call_id": "A01-C02",
          "evidence_bound": true,
          "execution_basis": "LOCAL_GPU_CANDIDATE_SELECTION",
          "human_gate": false,
          "input_artifact_ids": [
            "INGEST_MANIFEST"
          ],
          "output_artifact_ids": [
            "DGX_VISUAL"
          ],
          "purpose": "在DGX上筛选安全视频的场景变化候选。",
          "sequence": 2,
          "status": "COMPLETED",
          "tool_id": "KEYFRAME_LOOKUP"
        },
        {
          "call_id": "A01-C03",
          "evidence_bound": true,
          "execution_basis": "LOCAL_DETERMINISTIC",
          "human_gate": false,
          "input_artifact_ids": [
            "DGX_VISUAL"
          ],
          "output_artifact_ids": [
            "SOURCE_CANDIDATES"
          ],
          "purpose": "把同源关键帧合并为可回看的候选时间窗口。",
          "sequence": 3,
          "status": "COMPLETED",
          "tool_id": "VIDEO_INTERVAL_LOOKUP"
        },
        {
          "call_id": "A01-C04",
          "evidence_bound": true,
          "execution_basis": "LOCAL_DETERMINISTIC",
          "human_gate": false,
          "input_artifact_ids": [
            "INGEST_MANIFEST"
          ],
          "output_artifact_ids": [
            "SOURCE_CANDIDATES"
          ],
          "purpose": "把操作者口述答案绑定录音时间段和Evidence。",
          "sequence": 4,
          "status": "COMPLETED",
          "tool_id": "AUDIO_INTERVAL_LOOKUP"
        },
        {
          "call_id": "A01-C05",
          "evidence_bound": true,
          "execution_basis": "LOCAL_DETERMINISTIC",
          "human_gate": false,
          "input_artifact_ids": [
            "PDF_STRUCTURE",
            "DGX_VISUAL",
            "INGEST_MANIFEST"
          ],
          "output_artifact_ids": [
            "SOURCE_CANDIDATES",
            "MULTISOURCE_EVAL"
          ],
          "purpose": "合并视频、PDF和口述候选并验证多源覆盖。",
          "sequence": 5,
          "status": "COMPLETED",
          "tool_id": "EVIDENCE_SEARCH"
        }
      ],
      "label": "Perception Agent",
      "prohibited_action": "不得把GPU数值候选或稀疏关键帧自动升级为设备事实。",
      "responsibility": "提取带原页码、视频时间点和录音时间点的结构化Evidence及候选窗口。",
      "sequence": 1,
      "status": "COMPLETED"
    },
    {
      "agent_id": "SOP_AGENT",
      "allowed_tool_ids": [
        "EVIDENCE_SEARCH",
        "SOP_PLAN",
        "HUMAN_CONFIRM"
      ],
      "calls": [
        {
          "call_id": "A02-C01",
          "evidence_bound": true,
          "execution_basis": "HUMAN_VERIFIED_SOURCE_PROJECTION",
          "human_gate": false,
          "input_artifact_ids": [
            "SOURCE_CANDIDATES",
            "MULTISOURCE_EVAL"
          ],
          "output_artifact_ids": [
            "GOLD_SOP"
          ],
          "purpose": "从多源候选规划13步证据绑定SOP。",
          "sequence": 1,
          "status": "COMPLETED",
          "tool_id": "SOP_PLAN"
        },
        {
          "call_id": "A02-C02",
          "evidence_bound": true,
          "execution_basis": "HUMAN_REVIEW",
          "human_gate": true,
          "input_artifact_ids": [
            "GOLD_SOP"
          ],
          "output_artifact_ids": [
            "GOLD_SOP"
          ],
          "purpose": "由实际操作者确认步骤、条件、参数和成功标准。",
          "sequence": 2,
          "status": "COMPLETED",
          "tool_id": "HUMAN_CONFIRM"
        }
      ],
      "label": "SOP Agent",
      "prohibited_action": "不得补写无来源工具、参数或绝对安全承诺。",
      "responsibility": "依据Evidence与约束规划8至15步SOP、依赖和证据绑定。",
      "sequence": 2,
      "status": "COMPLETED"
    },
    {
      "agent_id": "CREATOR_AGENT",
      "allowed_tool_ids": [
        "ARTIFACT_SAVE",
        "ARTIFACT_RENDER"
      ],
      "calls": [
        {
          "call_id": "A03-C01",
          "evidence_bound": true,
          "execution_basis": "LOCAL_DETERMINISTIC",
          "human_gate": false,
          "input_artifact_ids": [
            "GOLD_SOP",
            "OUTPUT_PROFILE"
          ],
          "output_artifact_ids": [
            "SOP_VIEWS",
            "CHECKLIST",
            "QUIZ"
          ],
          "purpose": "生成三种SOP视图、手机清单和五类测验。",
          "sequence": 1,
          "status": "COMPLETED",
          "tool_id": "ARTIFACT_SAVE"
        },
        {
          "call_id": "A03-C02",
          "evidence_bound": true,
          "execution_basis": "TEXT_ONLY_TTS",
          "human_gate": false,
          "input_artifact_ids": [
            "GOLD_SOP",
            "OUTPUT_PROFILE"
          ],
          "output_artifact_ids": [
            "POSTER",
            "TRAINING_VIDEO"
          ],
          "purpose": "渲染A4海报和80秒证据绑定培训视频。",
          "sequence": 2,
          "status": "COMPLETED",
          "tool_id": "ARTIFACT_RENDER"
        }
      ],
      "label": "Creator Agent",
      "prohibited_action": "不得脱离Gold改变必要步骤、条件步骤或引用边界。",
      "responsibility": "从已绑定证据的Gold SOP生成清单、测验、海报和培训视频。",
      "sequence": 3,
      "status": "COMPLETED"
    },
    {
      "agent_id": "VERIFIER_AGENT",
      "allowed_tool_ids": [
        "RULE_VERIFY",
        "SEMANTIC_VERIFY"
      ],
      "calls": [
        {
          "call_id": "A04-C01",
          "evidence_bound": true,
          "execution_basis": "LOCAL_DETERMINISTIC",
          "human_gate": false,
          "input_artifact_ids": [
            "GOLD_SOP"
          ],
          "output_artifact_ids": [
            "INITIAL_CONFLICTS",
            "GROUNDING_GATE"
          ],
          "purpose": "对受控错误草稿执行确定性规则质检和无来源门禁。",
          "sequence": 1,
          "status": "COMPLETED",
          "tool_id": "RULE_VERIFY"
        },
        {
          "call_id": "A04-C02",
          "evidence_bound": true,
          "execution_basis": "AUTHORIZED_MODEL_INFERENCE",
          "human_gate": false,
          "input_artifact_ids": [
            "GOLD_SOP"
          ],
          "output_artifact_ids": [
            "SEMANTIC_REVIEW"
          ],
          "purpose": "对结构化步骤和Evidence陈述执行高推理语义复核。",
          "sequence": 2,
          "status": "COMPLETED",
          "tool_id": "SEMANTIC_VERIFY"
        },
        {
          "call_id": "A04-C03",
          "evidence_bound": true,
          "execution_basis": "LOCAL_DETERMINISTIC",
          "human_gate": false,
          "input_artifact_ids": [
            "AFTER_SOP"
          ],
          "output_artifact_ids": [
            "FINAL_CONFLICTS"
          ],
          "purpose": "对局部修订结果复检并确认严重问题归零。",
          "sequence": 3,
          "status": "COMPLETED",
          "tool_id": "RULE_VERIFY"
        }
      ],
      "label": "Verifier Agent",
      "prohibited_action": "不得直接覆盖人工Gold或把模型推断当作最终事实。",
      "responsibility": "检测遗漏、顺序、无依据工具、参数、安全声明和语义冲突。",
      "sequence": 4,
      "status": "COMPLETED"
    },
    {
      "agent_id": "REVISION_AGENT",
      "allowed_tool_ids": [
        "LOCAL_REVISION",
        "SELECTIVE_REBUILD",
        "HUMAN_CONFIRM"
      ],
      "calls": [
        {
          "call_id": "A05-C01",
          "evidence_bound": true,
          "execution_basis": "LOCAL_DETERMINISTIC",
          "human_gate": false,
          "input_artifact_ids": [
            "GOLD_SOP",
            "INITIAL_CONFLICTS"
          ],
          "output_artifact_ids": [
            "AFTER_SOP",
            "REVISION_AUDIT"
          ],
          "purpose": "按冲突和Evidence完成4项局部修改并保留审计。",
          "sequence": 1,
          "status": "COMPLETED",
          "tool_id": "LOCAL_REVISION"
        },
        {
          "call_id": "A05-C02",
          "evidence_bound": true,
          "execution_basis": "LOCAL_DETERMINISTIC",
          "human_gate": false,
          "input_artifact_ids": [
            "AFTER_SOP",
            "REVISION_AUDIT"
          ],
          "output_artifact_ids": [
            "SELECTIVE_REBUILD"
          ],
          "purpose": "只失效受位置或内容影响的步骤、题目和镜头。",
          "sequence": 2,
          "status": "COMPLETED",
          "tool_id": "SELECTIVE_REBUILD"
        }
      ],
      "label": "Revision Agent",
      "prohibited_action": "不得整包无差别重写或修改未受影响单元。",
      "responsibility": "引用Evidence执行字段级局部修订并计算下游选择性重建范围。",
      "sequence": 5,
      "status": "COMPLETED"
    }
  ],
  "artifact_type": "AGENT_TOOL_EXECUTION_TRACE",
  "artifacts": [
    {
      "artifact_id": "INGEST_MANIFEST",
      "classification": "PRIVATE_LOCAL_REFERENCE_DIGEST",
      "contains_raw_media": false,
      "kind": "JSON",
      "sha256": "7c2869a78e99c52d9317c7d1819112e91ae55bbc1c7cc08cfeba80660acf352c",
      "size_bytes": 3011
    },
    {
      "artifact_id": "DGX_VISUAL",
      "classification": "STRUCTURED_EVIDENCE",
      "contains_raw_media": false,
      "kind": "JSON",
      "sha256": "b475c03d34b4a5db8c423b97f72fdfc11d1d5e99e28c699ed2cac6fc912ab9fb",
      "size_bytes": 17979
    },
    {
      "artifact_id": "PDF_STRUCTURE",
      "classification": "STRUCTURED_EVIDENCE",
      "contains_raw_media": false,
      "kind": "JSON",
      "sha256": "0e40aea7fbdc3440a4c99e97e2a3db2e37f02b6e6a930445808ab2aee850aa97",
      "size_bytes": 5948
    },
    {
      "artifact_id": "SOURCE_CANDIDATES",
      "classification": "STRUCTURED_EVIDENCE",
      "contains_raw_media": false,
      "kind": "JSON",
      "sha256": "28708602befa289bb6a8ce97436b43384a2569a3de79c1b104011815d3c68ec3",
      "size_bytes": 68264
    },
    {
      "artifact_id": "MULTISOURCE_EVAL",